{
  "todo_list_id": "workflow_6b9e72ee71c9",
  "workflow_name": "CLI Request 20251108_143638",
  "created_at": "2025-11-08T11:36:38.773282Z",
  "created_by": "planner_service",
  "metadata": {
    "user_request": "Create MACD crossover strategy: buy when MACD crosses above signal line",
    "planner_version": "1.0.0",
    "auto_fix_mode": true,
    "max_branch_depth": 2,
    "max_debug_attempts": 3
  },
  "items": [
    {
      "id": "task_data_loading",
      "title": "Data Loading Integration",
      "description": "Implement fetch_and_prepare_data(symbol, start, end) to load OHLCV data into a DataFrame.",
      "agent_role": "coder",
      "priority": 1,
      "dependencies": [],
      "max_retries": 3,
      "timeout_seconds": 300,
      "acceptance_criteria": {
        "tests": [
          {
            "cmd": "pytest tests/test_adapter.py --json-report",
            "timeout_seconds": 60,
            "fixture": "fixtures/sample_aapl.csv"
          }
        ],
        "expected_artifacts": [
          "backtesting_adapter.py",
          "fixtures/sample_aapl.csv"
        ]
      },
      "input_artifacts": [],
      "output_artifacts": [
        "backtesting_adapter.py",
        "fixtures/sample_aapl.csv"
      ],
      "failure_routing": {
        "implementation_bug": "coder",
        "spec_mismatch": "architect",
        "timeout": "tester",
        "missing_dependency": "coder",
        "flaky_test": "tester"
      }
    },
    {
      "id": "task_indicators",
      "title": "Indicator Loading - MACD",
      "description": "Implement compute_macd(series, fast_period, slow_period, signal_period) function to calculate MACD values.",
      "agent_role": "coder",
      "priority": 2,
      "dependencies": [
        "task_data_loading"
      ],
      "max_retries": 3,
      "timeout_seconds": 300,
      "acceptance_criteria": {
        "tests": [
          {
            "cmd": "pytest tests/test_indicators.py --json-report",
            "timeout_seconds": 60,
            "fixture": "fixtures/macd_expected.json"
          }
        ],
        "expected_artifacts": [
          "indicators/macd.py",
          "fixtures/macd_expected.json"
        ]
      },
      "input_artifacts": [
        "backtesting_adapter.py"
      ],
      "output_artifacts": [
        "indicators/macd.py",
        "fixtures/macd_expected.json"
      ],
      "failure_routing": {
        "implementation_bug": "coder",
        "spec_mismatch": "architect",
        "timeout": "tester",
        "missing_dependency": "coder",
        "flaky_test": "tester"
      }
    },
    {
      "id": "task_entry",
      "title": "Entry Conditions - MACD Crossover",
      "description": "Implement should_enter(bar, indicators, position) function for MACD line crossing above the signal line.",
      "agent_role": "coder",
      "priority": 3,
      "dependencies": [
        "task_indicators"
      ],
      "max_retries": 3,
      "timeout_seconds": 300,
      "acceptance_criteria": {
        "tests": [
          {
            "cmd": "pytest tests/test_entry.py --json-report",
            "timeout_seconds": 60,
            "fixture": "fixtures/entry_scenarios.json"
          }
        ],
        "expected_artifacts": [
          "Backtest/codes/ai_strategy_entry.py",
          "fixtures/entry_scenarios.json"
        ]
      },
      "input_artifacts": [
        "indicators/macd.py"
      ],
      "output_artifacts": [
        "Backtest/codes/ai_strategy_entry.py",
        "fixtures/entry_scenarios.json"
      ],
      "failure_routing": {
        "implementation_bug": "coder",
        "spec_mismatch": "architect",
        "timeout": "tester",
        "missing_dependency": "coder",
        "flaky_test": "tester"
      }
    },
    {
      "id": "task_exit",
      "title": "Exit Conditions - Stop Loss/Take Profit",
      "description": "Implement should_exit(bar, indicators, position) function for stop loss and take profit levels.",
      "agent_role": "coder",
      "priority": 4,
      "dependencies": [
        "task_entry"
      ],
      "max_retries": 3,
      "timeout_seconds": 300,
      "acceptance_criteria": {
        "tests": [
          {
            "cmd": "pytest tests/test_exit.py --json-report",
            "timeout_seconds": 60,
            "fixture": "fixtures/exit_scenarios.json"
          }
        ],
        "expected_artifacts": [
          "Backtest/codes/ai_strategy_exit.py",
          "fixtures/exit_scenarios.json"
        ]
      },
      "input_artifacts": [
        "Backtest/codes/ai_strategy_entry.py"
      ],
      "output_artifacts": [
        "Backtest/codes/ai_strategy_exit.py",
        "fixtures/exit_scenarios.json"
      ],
      "failure_routing": {
        "implementation_bug": "coder",
        "spec_mismatch": "architect",
        "timeout": "tester",
        "missing_dependency": "coder",
        "flaky_test": "tester"
      }
    }
  ]
}