{
  "todo_list_id": "workflow_20251108_111258",
  "workflow_name": "CLI: Create simple RSI strategy with entry at RSI below",
  "created_at": "2025-11-08T11:12:58.246093Z",
  "created_by": "cli",
  "metadata": {
    "user_request": "Create simple RSI strategy with entry at RSI below 30 and exit at RSI above 70",
    "mode": "template",
    "planner_version": "template-1.0.0"
  },
  "items": [
    {
      "id": "task_coder_001",
      "title": "Implement Strategy Code",
      "description": "Create simple RSI strategy with entry at RSI below 30 and exit at RSI above 70",
      "agent_role": "coder",
      "priority": 1,
      "dependencies": [],
      "expected_duration_seconds": 300,
      "max_retries": 3,
      "timeout_seconds": 600,
      "acceptance_criteria": {
        "tests": [
          {
            "cmd": "python -m pytest tests/test_strategy.py",
            "timeout_seconds": 60
          }
        ],
        "expected_artifacts": [
          "Backtest/codes/strategy.py"
        ],
        "validation_rules": [
          {
            "type": "lint",
            "command": "python -m py_compile Backtest/codes/strategy.py",
            "expected_exit_code": 0
          }
        ]
      },
      "input_artifacts": [],
      "output_artifacts": [
        "Backtest/codes/strategy.py"
      ],
      "tags": [
        "strategy",
        "cli"
      ],
      "failure_routing": {
        "implementation_bug": "coder",
        "spec_mismatch": "architect",
        "timeout": "tester",
        "missing_dependency": "coder",
        "flaky_test": "tester"
      }
    }
  ]
}