{
  "todo_list_id": "workflow_20260110_160507",
  "workflow_name": "CLI: make a simple EMA crossover strategy that uses 30 ",
  "created_at": "2026-01-10T16:05:07.945737Z",
  "created_by": "cli",
  "metadata": {
    "user_request": "make a simple EMA crossover strategy that uses 30 and 70 periods crossing each other for entry. Open long positions when 30 ema crosses above 70 ema and enter short position when 70 ema crosses below 30 ema. The stop loss should be set 15 pips from entry and take profit should be 70 pips from entry",
    "mode": "template",
    "planner_version": "template-1.0.0"
  },
  "items": [
    {
      "id": "task_coder_001",
      "title": "Implement Strategy Code",
      "description": "make a simple EMA crossover strategy that uses 30 and 70 periods crossing each other for entry. Open long positions when 30 ema crosses above 70 ema and enter short position when 70 ema crosses below 30 ema. The stop loss should be set 15 pips from entry and take profit should be 70 pips from entry",
      "agent_role": "coder",
      "priority": 1,
      "dependencies": [],
      "expected_duration_seconds": 300,
      "max_retries": 3,
      "timeout_seconds": 600,
      "contract_path": "C:\\Users\\nyaga\\Documents\\AlgoAgent\\multi_agent\\workflows\\contract_cli_strategy.json",
      "acceptance_criteria": {
        "tests": [
          {
            "cmd": "python -m pytest tests/test_strategy.py",
            "timeout_seconds": 60
          }
        ],
        "expected_artifacts": [
          "Backtest/codes/strategy.py"
        ],
        "validation_rules": [
          {
            "type": "lint",
            "command": "python -m py_compile Backtest/codes/strategy.py",
            "expected_exit_code": 0
          }
        ]
      },
      "input_artifacts": [],
      "output_artifacts": [
        "Backtest/codes/strategy.py"
      ],
      "tags": [
        "strategy",
        "cli"
      ],
      "failure_routing": {
        "implementation_bug": "coder",
        "spec_mismatch": "architect",
        "timeout": "tester",
        "missing_dependency": "coder",
        "flaky_test": "tester"
      }
    }
  ]
}