{
  "todo_list_id": "workflow_20260210_010810",
  "workflow_name": "CLI: I want to create a simple EM corossover trading st",
  "created_at": "2026-02-10T01:08:10.690415Z",
  "created_by": "cli",
  "metadata": {
    "user_request": "I want to create a simple EM corossover trading strategy. Use two exponential moving averages: One EMA with a period of 30 and the other with a period of 70. Long(buy) entries trade when the 30 EMA crosses above the 70 EMA and short (sell) trade when the 30 EMA crosses below the 70 EMA. Stop loss should be set 15 pips away from the entry price and take profit at 70 pips away from the entry price.",
    "mode": "template",
    "planner_version": "template-1.0.0"
  },
  "items": [
    {
      "id": "task_coder_001",
      "title": "Implement Strategy Code",
      "description": "I want to create a simple EM corossover trading strategy. Use two exponential moving averages: One EMA with a period of 30 and the other with a period of 70. Long(buy) entries trade when the 30 EMA crosses above the 70 EMA and short (sell) trade when the 30 EMA crosses below the 70 EMA. Stop loss should be set 15 pips away from the entry price and take profit at 70 pips away from the entry price.",
      "agent_role": "coder",
      "priority": 1,
      "dependencies": [],
      "expected_duration_seconds": 300,
      "max_retries": 3,
      "timeout_seconds": 600,
      "contract_path": "C:\\Users\\nyaga\\Documents\\AlgoAgent\\multi_agent\\workflows\\contract_cli_strategy.json",
      "acceptance_criteria": {
        "tests": [
          {
            "cmd": "python -m pytest tests/test_strategy.py",
            "timeout_seconds": 60
          }
        ],
        "expected_artifacts": [
          "Backtest/codes/strategy.py"
        ],
        "validation_rules": [
          {
            "type": "lint",
            "command": "python -m py_compile Backtest/codes/strategy.py",
            "expected_exit_code": 0
          }
        ]
      },
      "input_artifacts": [],
      "output_artifacts": [
        "Backtest/codes/strategy.py"
      ],
      "tags": [
        "strategy",
        "cli"
      ],
      "failure_routing": {
        "implementation_bug": "coder",
        "spec_mismatch": "architect",
        "timeout": "tester",
        "missing_dependency": "coder",
        "flaky_test": "tester"
      }
    }
  ]
}