{
  "todo_list_id": "workflow_c0d825028017",
  "workflow_name": "CLI Request 20251112_201146",
  "created_at": "2025-11-12T17:11:46.866599Z",
  "created_by": "planner_service",
  "metadata": {
    "user_request": "Create simple RSI strategy with 30/70 levels",
    "planner_version": "1.0.0",
    "auto_fix_mode": true,
    "max_branch_depth": 2,
    "max_debug_attempts": 3
  },
  "items": [
    {
      "id": "task_data_loading_rsi",
      "title": "Data Loading Integration for RSI Strategy",
      "description": "Implement fetch_and_prepare_data(symbol, start, end) to load OHLCV data. Output DataFrame must include ['Date', 'Open', 'High', 'Low', 'Close', 'Volume'] and be ready for indicator computation.",
      "agent_role": "coder",
      "priority": 1,
      "dependencies": [],
      "max_retries": 3,
      "timeout_seconds": 300,
      "acceptance_criteria": {
        "tests": [
          {
            "cmd": "pytest tests/test_backtesting_adapter.py --json-report",
            "timeout_seconds": 60,
            "expected_exit_code": 0,
            "fixture": "fixtures/sample_aapl.csv"
          }
        ]
      },
      "output_artifacts": [
        "backtesting_adapter.py",
        "fixtures/sample_aapl.csv"
      ],
      "failure_routing": {
        "implementation_bug": "coder",
        "spec_mismatch": "architect",
        "timeout": "tester",
        "missing_dependency": "coder",
        "flaky_test": "tester"
      }
    },
    {
      "id": "task_indicator_rsi",
      "title": "Indicator Loading - RSI (14-period)",
      "description": "Architect designs contract for RSI calculation. Coder implements compute_rsi(series, period=14) function to calculate Relative Strength Index based on closing prices. Validation against known RSI values is critical.",
      "agent_role": "architect",
      "priority": 2,
      "dependencies": [
        "task_data_loading_rsi"
      ],
      "max_retries": 3,
      "timeout_seconds": 300,
      "acceptance_criteria": {
        "tests": [
          {
            "cmd": "pytest tests/test_indicators.py::test_compute_rsi --json-report",
            "timeout_seconds": 60,
            "expected_exit_code": 0,
            "fixture": "fixtures/rsi_expected.json"
          }
        ]
      },
      "output_artifacts": [
        "contracts/indicator_contract.json",
        "indicators/rsi.py",
        "fixtures/rsi_expected.json"
      ],
      "failure_routing": {
        "implementation_bug": "coder",
        "spec_mismatch": "architect",
        "timeout": "tester",
        "missing_dependency": "coder",
        "flaky_test": "tester"
      }
    },
    {
      "id": "task_entry_conditions_rsi",
      "title": "Entry Conditions Setup - RSI < 30 (Oversold)",
      "description": "Implement should_enter(bar, indicators, position) function. The entry condition is met when the RSI (14-period) crosses below or is less than 30, indicating an oversold condition.",
      "agent_role": "coder",
      "priority": 3,
      "dependencies": [
        "task_indicator_rsi"
      ],
      "max_retries": 3,
      "timeout_seconds": 300,
      "acceptance_criteria": {
        "tests": [
          {
            "cmd": "pytest tests/test_ai_strategy_entry.py --json-report",
            "timeout_seconds": 60,
            "expected_exit_code": 0,
            "fixture": "fixtures/entry_scenarios.json"
          }
        ]
      },
      "output_artifacts": [
        "Backtest/codes/ai_strategy_entry.py",
        "fixtures/entry_scenarios.json"
      ],
      "failure_routing": {
        "implementation_bug": "coder",
        "spec_mismatch": "architect",
        "timeout": "tester",
        "missing_dependency": "coder",
        "flaky_test": "tester"
      }
    },
    {
      "id": "task_exit_conditions_rsi",
      "title": "Exit Conditions Setup - RSI > 70 (Overbought) + SL/TP",
      "description": "Implement should_exit(bar, indicators, position) function. Exit conditions include: RSI (14-period) crosses above or is greater than 70 (overbought), or if a predefined stop loss or take profit level is triggered.",
      "agent_role": "coder",
      "priority": 4,
      "dependencies": [
        "task_entry_conditions_rsi"
      ],
      "max_retries": 3,
      "timeout_seconds": 300,
      "acceptance_criteria": {
        "tests": [
          {
            "cmd": "pytest tests/test_ai_strategy_exit.py --json-report",
            "timeout_seconds": 60,
            "expected_exit_code": 0,
            "fixture": "fixtures/exit_scenarios.json"
          }
        ]
      },
      "output_artifacts": [
        "Backtest/codes/ai_strategy_exit.py",
        "fixtures/exit_scenarios.json"
      ],
      "failure_routing": {
        "implementation_bug": "coder",
        "spec_mismatch": "architect",
        "timeout": "tester",
        "missing_dependency": "coder",
        "flaky_test": "tester"
      }
    }
  ]
}