{
  "todo_list_id": "workflow_7dec68995ae7",
  "workflow_name": "CLI Request 20251120_205623",
  "created_at": "2025-11-20T17:56:23.853268Z",
  "created_by": "planner_service",
  "metadata": {
    "user_request": "Create a simple moving average crossover strategy. Buy when fast SMA crosses above slow SMA, sell when it crosses below. Use 10-period fast and 30-period slow.",
    "planner_version": "1.0.0",
    "auto_fix_mode": true,
    "max_branch_depth": 2,
    "max_debug_attempts": 3
  },
  "items": [
    {
      "id": "task_data_loading_sma",
      "title": "Data Loading Integration for SMA Strategy",
      "description": "Implement fetch_and_prepare_data(symbol, start, end) to load OHLCV data for the SMA crossover strategy. Ensure the output DataFrame has 'Date', 'Open', 'High', 'Low', 'Close', 'Volume' columns.",
      "agent_role": "coder",
      "priority": 1,
      "dependencies": [],
      "max_retries": 3,
      "timeout_seconds": 300,
      "acceptance_criteria": {
        "tests": [
          {
            "cmd": "pytest tests/test_adapter.py --json-report=report_data_loading.json",
            "timeout_seconds": 60,
            "expected_exit_code": 0,
            "fixture": "fixtures/sample_aapl.csv"
          }
        ]
      },
      "output_artifacts": [
        "backtesting_adapter.py",
        "fixtures/sample_aapl.csv"
      ],
      "failure_routing": {
        "implementation_bug": "coder",
        "spec_mismatch": "architect",
        "timeout": "tester",
        "missing_dependency": "coder",
        "flaky_test": "tester"
      }
    },
    {
      "id": "task_indicators_sma",
      "title": "Indicator Loading - Fast and Slow SMA",
      "description": "Implement compute_sma(series, period) for both 10-period (fast) and 30-period (slow) Simple Moving Averages. This task involves defining the contract and then implementing the indicator.",
      "agent_role": "architect",
      "priority": 2,
      "dependencies": [
        "task_data_loading_sma"
      ],
      "max_retries": 3,
      "timeout_seconds": 300,
      "acceptance_criteria": {
        "tests": [
          {
            "cmd": "pytest tests/test_indicators_sma.py --json-report=report_indicators_sma.json",
            "timeout_seconds": 60,
            "expected_exit_code": 0,
            "fixture": "fixtures/sma_expected.json"
          }
        ]
      },
      "output_artifacts": [
        "contracts/indicator_contract.json",
        "indicators/sma.py",
        "fixtures/sma_expected.json"
      ],
      "failure_routing": {
        "implementation_bug": "coder",
        "spec_mismatch": "architect",
        "timeout": "tester",
        "missing_dependency": "coder",
        "flaky_test": "tester"
      }
    },
    {
      "id": "task_entry_sma_crossover",
      "title": "Entry Conditions - Fast SMA Crosses Above Slow SMA",
      "description": "Implement should_enter(bar, indicators, position) to define the buy signal: when the 10-period (fast) SMA crosses above the 30-period (slow) SMA.",
      "agent_role": "coder",
      "priority": 3,
      "dependencies": [
        "task_indicators_sma"
      ],
      "max_retries": 3,
      "timeout_seconds": 300,
      "acceptance_criteria": {
        "tests": [
          {
            "cmd": "pytest tests/test_entry_sma.py --json-report=report_entry_sma.json",
            "timeout_seconds": 60,
            "expected_exit_code": 0,
            "fixture": "fixtures/entry_scenarios_sma.json"
          }
        ]
      },
      "output_artifacts": [
        "Backtest/codes/ai_strategy_entry.py",
        "fixtures/entry_scenarios_sma.json"
      ],
      "failure_routing": {
        "implementation_bug": "coder",
        "spec_mismatch": "architect",
        "timeout": "tester",
        "missing_dependency": "coder",
        "flaky_test": "tester"
      }
    },
    {
      "id": "task_exit_sma_crossover",
      "title": "Exit Conditions - Fast SMA Crosses Below Slow SMA + SL/TP",
      "description": "Implement should_exit(bar, indicators, position) to define the sell signal: when the 10-period (fast) SMA crosses below the 30-period (slow) SMA. Also include standard stop loss and take profit logic.",
      "agent_role": "coder",
      "priority": 4,
      "dependencies": [
        "task_entry_sma_crossover"
      ],
      "max_retries": 3,
      "timeout_seconds": 300,
      "acceptance_criteria": {
        "tests": [
          {
            "cmd": "pytest tests/test_exit_sma.py --json-report=report_exit_sma.json",
            "timeout_seconds": 60,
            "expected_exit_code": 0,
            "fixture": "fixtures/exit_scenarios_sma.json"
          }
        ]
      },
      "output_artifacts": [
        "Backtest/codes/ai_strategy_exit.py",
        "fixtures/exit_scenarios_sma.json"
      ],
      "failure_routing": {
        "implementation_bug": "coder",
        "spec_mismatch": "architect",
        "timeout": "tester",
        "missing_dependency": "coder",
        "flaky_test": "tester"
      }
    }
  ]
}