{
  "todo_list_id": "workflow_a8ef0bbb8729",
  "workflow_name": "CLI Request 20251108_121005",
  "created_at": "2025-11-08T09:10:05.849539Z",
  "created_by": "planner_service",
  "metadata": {
    "user_request": "Create MACD strategy with 12-26-9 parameters",
    "planner_version": "1.0.0",
    "auto_fix_mode": true,
    "max_branch_depth": 2,
    "max_debug_attempts": 3
  },
  "items": [
    {
      "id": "task_data_loading",
      "title": "Data Loading Integration",
      "description": "Implement fetch_and_prepare_data to load OHLCV data for MACD strategy",
      "agent_role": "coder",
      "priority": 1,
      "dependencies": [],
      "max_retries": 3,
      "timeout_seconds": 300,
      "acceptance_criteria": {
        "tests": [
          {
            "cmd": "pytest tests/test_adapter.py",
            "timeout_seconds": 60,
            "fixture": "fixtures/sample_aapl.csv"
          }
        ],
        "expected_artifacts": [
          "backtesting_adapter.py",
          "fixtures/sample_aapl.csv"
        ]
      },
      "input_artifacts": [],
      "output_artifacts": [
        "backtesting_adapter.py",
        "fixtures/sample_aapl.csv"
      ],
      "failure_routing": {
        "implementation_bug": "coder",
        "spec_mismatch": "architect",
        "timeout": "tester",
        "missing_dependency": "coder",
        "flaky_test": "tester"
      }
    },
    {
      "id": "task_indicators",
      "title": "Indicator Loading - MACD (12, 26, 9)",
      "description": "Implement compute_macd function with 12, 26, 9 parameters",
      "agent_role": "coder",
      "priority": 2,
      "dependencies": [
        "task_data_loading"
      ],
      "max_retries": 3,
      "timeout_seconds": 300,
      "acceptance_criteria": {
        "tests": [
          {
            "cmd": "pytest tests/test_indicators.py",
            "timeout_seconds": 60,
            "fixture": "fixtures/macd_expected.json"
          }
        ],
        "expected_artifacts": [
          "indicators/macd.py",
          "fixtures/macd_expected.json"
        ]
      },
      "input_artifacts": [
        "backtesting_adapter.py",
        "fixtures/sample_aapl.csv"
      ],
      "output_artifacts": [
        "indicators/macd.py",
        "fixtures/macd_expected.json"
      ],
      "failure_routing": {
        "implementation_bug": "coder",
        "spec_mismatch": "architect",
        "timeout": "tester",
        "missing_dependency": "coder",
        "flaky_test": "tester"
      }
    },
    {
      "id": "task_entry",
      "title": "Entry Conditions - MACD Crossover",
      "description": "Implement should_enter for MACD crossover signal",
      "agent_role": "coder",
      "priority": 3,
      "dependencies": [
        "task_indicators"
      ],
      "max_retries": 3,
      "timeout_seconds": 300,
      "acceptance_criteria": {
        "tests": [
          {
            "cmd": "pytest tests/test_entry.py",
            "timeout_seconds": 60,
            "fixture": "fixtures/entry_scenarios.json"
          }
        ],
        "expected_artifacts": [
          "Backtest/codes/ai_strategy_entry.py",
          "fixtures/entry_scenarios.json"
        ]
      },
      "input_artifacts": [
        "indicators/macd.py",
        "fixtures/macd_expected.json"
      ],
      "output_artifacts": [
        "Backtest/codes/ai_strategy_entry.py",
        "fixtures/entry_scenarios.json"
      ],
      "failure_routing": {
        "implementation_bug": "coder",
        "spec_mismatch": "architect",
        "timeout": "tester",
        "missing_dependency": "coder",
        "flaky_test": "tester"
      }
    },
    {
      "id": "task_exit",
      "title": "Exit Conditions - MACD Signal Line Crossover + SL/TP",
      "description": "Implement should_exit for MACD signal line crossover and stop loss/take profit",
      "agent_role": "coder",
      "priority": 4,
      "dependencies": [
        "task_entry"
      ],
      "max_retries": 3,
      "timeout_seconds": 300,
      "acceptance_criteria": {
        "tests": [
          {
            "cmd": "pytest tests/test_exit.py",
            "timeout_seconds": 60,
            "fixture": "fixtures/exit_scenarios.json"
          }
        ],
        "expected_artifacts": [
          "Backtest/codes/ai_strategy_exit.py",
          "fixtures/exit_scenarios.json"
        ]
      },
      "input_artifacts": [
        "Backtest/codes/ai_strategy_entry.py",
        "fixtures/entry_scenarios.json"
      ],
      "output_artifacts": [
        "Backtest/codes/ai_strategy_exit.py",
        "fixtures/exit_scenarios.json"
      ],
      "failure_routing": {
        "implementation_bug": "coder",
        "spec_mismatch": "architect",
        "timeout": "tester",
        "missing_dependency": "coder",
        "flaky_test": "tester"
      }
    }
  ]
}