{
  "todo_list_id": "workflow_20251108_110322",
  "workflow_name": "CLI: Create a simple RSI strategy with buy signal when ",
  "created_at": "2025-11-08T11:03:22.743098Z",
  "created_by": "cli",
  "metadata": {
    "user_request": "Create a simple RSI strategy with buy signal when RSI < 30 and sell signal when RSI > 70",
    "mode": "template",
    "planner_version": "template-1.0.0"
  },
  "items": [
    {
      "id": "task_coder_001",
      "title": "Implement Strategy Code",
      "description": "Create a simple RSI strategy with buy signal when RSI < 30 and sell signal when RSI > 70",
      "agent_role": "coder",
      "priority": 1,
      "dependencies": [],
      "expected_duration_seconds": 300,
      "max_retries": 3,
      "timeout_seconds": 600,
      "acceptance_criteria": {
        "tests": [],
        "expected_artifacts": [
          "Backtest/codes/strategy.py"
        ],
        "validation_rules": []
      },
      "input_artifacts": [],
      "output_artifacts": [
        "Backtest/codes/strategy.py"
      ],
      "tags": [
        "strategy",
        "cli"
      ]
    }
  ]
}